{
  "$schema": "https://json-schema.org/draft/2020-12/schema",
  "$id": "https://math-coding.org/schema/3.3/attestation.json",
  "type": "object",
  "additionalProperties": false,
  "required": [
    "schema", "kind", "id", "subject", "kind_", "producer",
    "result", "issued_at"
  ],
  "properties": {
    "schema": {"enum": ["math-coding/attestation-3.0-alpha", "math-coding/attestation-3.3"]},
    "kind": {"const": "attestation"},
    "id": {"type": "string", "pattern": "^sha256:[0-9a-f]{64}$"},
    "subject": {
      "type": "object", "additionalProperties": false,
      "required": ["decision", "obligation", "candidate_tree", "materials_digest"],
      "properties": {
        "decision": {"type": "string"},
        "decision_revision": {"type": "string"},
        "decision_digest": {"type": "string"},
        "obligation": {"type": "string"},
        "obligation_digest": {"type": "string"},
        "candidate_tree": {"type": "string"},
        "materials_digest": {
          "description": "SEMANTICS A: the digest of the CONTENT of the files the decision's `scope.paths` names. The content is addressed by git blob ids, so the digest changes exactly when a named file's bytes change. The gate computes the same value from the same tree and compares; the producer (`mathc attest-batch`) writes the same value. Per A0 separation (spec/constitution.md §0), this field MUST be non-empty when `kind_` is in `{test, build, observation, analysis}`. An empty value is permitted only when `kind_: review` (a human declaration without a runtime anchor). The kernel emits MC-MATERIALS-DIGEST-EMPTY (Block) for runtime kinds. Loader-side grandfathering for legacy attestations whose `issued_at` predates 2026-10-16 lives in lib/attestations/attestations.ml. The attestation store itself is EXCLUDED from the scope digest: the store is evidence about a scope, not part of it, and including it would make every attestation stale the moment it is committed.",
          "type": "string"
        }
      }
    },
    "kind_": {"enum": ["test", "review", "build", "analysis", "observation"]},
    "producer": {
      "description": "Who produced this attestation, and on what runtime anchor. `identity` is class-tagged (`human:` a person, `agent:` a model-driven agent, `ci:` an automated job); the tag is what lets a reader tell a human DECLARATION from a machine OBSERVATION without guessing. `run` names the command whose exit code and output digest produced the attestation, and is REQUIRED whenever a `human:` producer signs a runtime-kind attestation -- a human may declare a review without a runtime anchor, but may not borrow the evidentiary weight of a run they did not name. Per decisions/attestation-producer-vocab-2026-10.",
      "type": "object", "additionalProperties": false,
      "required": ["identity"],
      "properties": {
        "identity": {
          "description": "Class-tagged producer identity `<class>:<subject>`, with `class` in {human, agent, ci}. The subject may itself contain colons (e.g. `ci:fixture:conformance`, `agent:opencode:ux-3-merge`). An untagged identity asserts nothing about WHO produced the attestation and is rejected (MC-PRODUCER-CLASS-UNDECLARED, Block) on issuance; 62 attestations committed before 2026-10-23 carry untagged identities (`ci-bot`, `dune:test`, `test`, `sub-agent-A4-batchA`, ...) and remain readable by the store loader. A `human:` tag is a DECLARATION, not a proof: the schema cannot verify that a person typed it, so the rule that carries the weight is the one below -- a `human:` producer signing a runtime kind must name the run.",
          "type": "string",
          "pattern": "^(human|agent|ci):[A-Za-z0-9][A-Za-z0-9._:/-]*$"
        },
        "run": {
          "description": "The command whose exit code and output digest produced this attestation (the `--run` argument of `mathc attest`). Empty is permitted only when `kind_: review` or the producer class is not `human`; see the allOf rule on this schema.",
          "type": "string",
          "minLength": 1
        }
      },
      "allOf": [
        {
          "if": {
            "required": ["kind_", "producer"],
            "properties": {
              "kind_": {"enum": ["test", "build", "analysis", "observation"]},
              "producer": {
                "required": ["identity"],
                "properties": {"identity": {"pattern": "^human:"}}
              }
            }
          },
          "then": {
            "properties": {
              "producer": {
                "required": ["run"],
                "properties": {"run": {"type": "string", "minLength": 1}}
              }
            }
          }
        }
      ]
    },
    "environment_class": {
      "description": "Free-form environment class string (legacy). Use environment_class_label + environment_class_level for new attestations.",
      "type": "string"
    },
    "environment_class_level": {
      "description": "Numeric environment class level 0..4. See spec/kernel-contract.md §13 and §14 (decisive_threshold).",
      "$ref": "common.json#/definitions/environment_class_level"
    },
    "environment_class_label": {
      "description": "Coarse environment class label. See spec/kernel-contract.md §13.",
      "$ref": "common.json#/definitions/environment_class_label"
    },
    "ci_run_id": {
      "description": "Identifier of the CI run that produced this attestation. Used as input to attestation id derivation. See spec/kernel-contract.md §13.",
      "type": "string",
      "minLength": 1
    },
    "substrate_digest": {
      "description": "sha256 of (kernel version || ocaml version || dependency digests). See spec/kernel-contract.md §13, §16.",
      "type": "string",
      "pattern": "^sha256:[0-9a-f]{64}$"
    },
    "substrate_fingerprint": {
      "description": "Identifier (𝓢.id) of the substrate declaration this attestation was produced against. See spec/kernel-contract.md §13, §16.",
      "type": "string",
      "minLength": 1
    },
    "result": {"enum": ["pass", "fail", "inconclusive", "infrastructure-error"]},
    "issued_at": {"$ref": "common.json#/definitions/timestamp"},
    "valid_until": {"$ref": "common.json#/definitions/timestamp"},
    "evidence_digest": {
      "type": "string",
      "description": "The digest of what a `--run` command actually produced. This is EVIDENCE, not the materials anchor: `subject.materials_digest` binds the attestation to the content of the decision's scope, while this field records the output of the check that was run. Before semantics A the two were conflated - the run output digest was written into `materials_digest`, where the gate compared it against a digest of changed PATH NAMES - so the two could never be equal and the only attestation the freshness check ever accepted was the one carrying no evidence at all. Empty when no run was executed."
    },
    "signature": {
      "type": "object", "additionalProperties": false,
      "required": ["format", "key_id", "value"],
      "properties": {
        "format": {"const": "dsse"},
        "key_id": {"type": "string"},
        "value": {"type": "string", "minLength": 1}
      }
    },
    "time_observed": {
      "type": "object",
      "additionalProperties": false,
      "description": "Optional wall-clock / token-budget / step-count observation closed against a corresponding Decision.time.estimate. Required: scale, value. Optional: observed_at, observed_by. See AGENTS.md §Honest time reporting and bootstrap/time-honesty.yaml.",
      "required": ["scale", "value"],
      "properties": {
        "scale": {"enum": ["wall-clock-minutes", "token-budget", "step-count"]},
        "value": {"type": "number", "minimum": 0},
        "observed_at": {"$ref": "common.json#/definitions/timestamp"},
        "observed_by": {"type": "string"}
      }
    }
  }
}
