{"id":"sha256:2b04831c0122af9047251b53b68e074bf384db635a962cdfa8a9f7d3c9d45bdf","issued_at":"2026-10-25T16:08:25Z","kind":"attestation","kind_":"test","producer":{"identity":"ci:kernel:resign","run":"run-per-obligation"},"result":"pass","schema":"math-coding/attestation-3.3","subject":{"candidate_tree":"576871492ab6aa75f993d1cfebb41802723603a3","decision":"gate-attestation-store-fill","materials_digest":"sha256:aca34b598448e10d61ad21a3f7a43e36354fb6951c48b72da7a0dd4fb54d5929","obligation":"gate-real-verdict"}}
