{"id":"sha256:d8ec3772a79f3c793d9fbec8fe300b9545dc4947ee93b6b153488aa2db0e26e2","issued_at":"2026-10-24T05:04:56Z","kind":"attestation","kind_":"test","producer":{"identity":"ci:kernel:resign"},"result":"pass","schema":"math-coding/attestation-3.3","subject":{"candidate_tree":"5b27fc871b938d65217af410ba1ff002fe235bd6","decision":"process-principles","materials_digest":"sha256:0bd9540da4829deeaf9869f2f0466f1a7d6ddf4fc2f1bbe155a059d1cc865d1b","obligation":"p7-honesty-in-fixture-assertions"}}
