{"schema":"math-coding/attestation-3.0-alpha","kind":"attestation","subject":{"decision":"enforce-body-sha-digest-2026-10","obligation":"store-is-digest-current","candidate_tree":"HEAD","materials_digest":""},"kind_":"review","producer":{"identity":"human:maintainer"},"result":"pass","issued_at":"2026-09-29T18:00:00Z","id":"sha256:221a2583714724467bc752d83ca6d3b69f157bb0dbb75122a305ffa97af5c8f1"}
