{"id":"sha256:9e9b930bf0c8a9be3a5320ab6d9f539aa34457f4a247578d3b5d11babbc2f921","issued_at":"2026-10-23T22:41:22Z","kind":"attestation","kind_":"review","producer":{"identity":"ci:kernel:resign"},"result":"pass","schema":"math-coding/attestation-3.3","subject":{"candidate_tree":"fc610b002709e27fcf53f95ede70049f51c3f15d","decision":"process-fastpath-pattern-2026-10","materials_digest":"sha256:b65a570342d2d70b38a4fb51ae9cb105422ff101b26967dfac24ada04bddf9e1","obligation":"agents-md-footer-points-to-decision"}}
