{"schema":"math-coding/attestation-3.0-alpha","kind":"attestation","subject":{"decision":"antithesis-mode-considered-2026-10","obligation":"legacy-decisions-still-validate","candidate_tree":"HEAD","materials_digest":""},"kind_":"review","producer":{"identity":"human:maintainer"},"result":"pass","issued_at":"2026-09-29T18:00:00Z","id":"sha256:f2a466a7d9df869df017fa72bc640ba2f384432113db121b41551b2cb3d209e7"}
