{"id":"sha256:11bda356cca7f9c5115291bc67eccb1feeaaf5d782e0a954bb0446e925af627a","issued_at":"2026-10-25T07:45:30Z","kind":"attestation","kind_":"test","producer":{"identity":"ci:kernel:resign"},"result":"pass","schema":"math-coding/attestation-3.3","subject":{"candidate_tree":"ee68e96c863455bade5afc674e3a230cf2ba8dea","decision":"3-2-cli-catalog","materials_digest":"sha256:8621e7667f65cfd33a3dd47e567c6b1df93abd2174bfc0c09f66c6d5228be4b4","obligation":"mode-subcommand-spec-row"}}
