{"schema":"math-coding/attestation-3.0-alpha","kind":"attestation","subject":{"decision":"winget-manifest-pr-2026-10","obligation":"winget-generator-shipped","candidate_tree":"HEAD","materials_digest":""},"kind_":"review","producer":{"identity":"human:maintainer"},"result":"pass","issued_at":"2026-09-29T18:00:00Z","id":"sha256:ca4a17ed1242a5c9aed4f6802abd312847f09d1052b859ea5f98d27fedde2809"}
