{"schema":"math-coding/attestation-3.0-alpha","kind":"attestation","subject":{"decision":"scoop-manifest-pr-2026-10","obligation":"scoop-publish-md","candidate_tree":"HEAD","materials_digest":""},"kind_":"review","producer":{"identity":"human:maintainer"},"result":"pass","issued_at":"2026-09-29T18:00:00Z","id":"sha256:7b07183b963fdbd43762c493e76d4590801861676c2572c7bdb42cc0b1d945fd"}
