{"id":"sha256:f57dd031f3f71d2a65920e96bee9959d8db1f115f684a5a56c516aab7cda42f4","issued_at":"2026-10-25T08:07:08Z","kind":"attestation","kind_":"review","producer":{"identity":"ci:kernel:resign"},"result":"inconclusive","schema":"math-coding/attestation-3.3","subject":{"candidate_tree":"c5b6788b2a47cda98b69730cf6f43821cddce2fe","decision":"verifier-result-memo-2026-10","materials_digest":"sha256:69cb8c9eabf28d1e7af2896a2ffaf4d0e0df3d7fcd8a92a323a4a4b3c76327f6","obligation":"a-verifier-runs-once-per-sweep"}}
