{"id":"sha256:1f008dde0636d54671c430ebfef421b6ddf3168ec9de80b0d1ec8604253bbc4a","issued_at":"2026-10-25T14:36:39Z","kind":"attestation","kind_":"review","producer":{"identity":"ci:kernel:resign"},"result":"inconclusive","schema":"math-coding/attestation-3.3","subject":{"candidate_tree":"350e88dc989a249454261e394bac6a60ef06f460","decision":"path-resolver-audit-2026-11","materials_digest":"sha256:7224c8123c75d64f407fca2a452829c15da0ad0464fd95102b8a65c82eb441c6","obligation":"a2-no-literal-paths"}}
