{"schema":"math-coding/attestation-3.0-alpha","kind":"attestation","subject":{"decision":"ux-3-nfr3-cold-start-2026-10","obligation":"this-decision-validates","candidate_tree":"HEAD","materials_digest":""},"kind_":"review","producer":{"identity":"human:maintainer"},"result":"pass","issued_at":"2026-09-29T18:00:00Z","id":"sha256:2894bda1208d784b52556b4e5a4d0302bdc1be175fb02a45b2a480135210d5a2"}
