{"id":"sha256:34ca20b24f76c79f817c0ab860e35aaffe60d78ff3b65edbe2686e2e778bb65a","issued_at":"2026-10-24T03:01:59Z","kind":"attestation","kind_":"test","producer":{"identity":"ci:kernel:resign"},"result":"pass","schema":"math-coding/attestation-3.3","subject":{"candidate_tree":"50eea5e450fcda1f453aa929c1b79b5ef9c4f9e0","decision":"duplicate-mapping-keys-silent-drop-2026-10","materials_digest":"sha256:ab1f95fc58ed90d8f52b9265d91523695306a6b746324d6c669075d0a5f37eff","obligation":"detector-reads-the-same-tree-as-the-readers"}}
