{"id":"sha256:290f42130e40a9ac11de205886053fd6d7947b97fe6a213bf85e67d90b0c54df","issued_at":"2026-10-25T04:58:58Z","kind":"attestation","kind_":"test","producer":{"identity":"ci:resign"},"result":"fail","schema":"math-coding/attestation-3.3","subject":{"candidate_tree":"db020e8c645f6685b5b3eac293e9b29054f92176","decision":"ux-3-telemetry-stub-2026-10","materials_digest":"sha256:037cfba368ce5a991cc085c079f45fcbaee7915fe7b8e726c3f3bd7467c95ec3","obligation":"env-var-stable"}}
