{"id":"sha256:a8c48b0e18d024e0c37fdc5cf4ec318ad5796e7c3dd859a67624c8e7f7b5fc6a","issued_at":"2026-10-23T22:48:39Z","kind":"attestation","kind_":"observation","producer":{"identity":"ci:kernel:resign"},"result":"pass","schema":"math-coding/attestation-3.3","subject":{"candidate_tree":"f287ebee0ed66ccff7f260afb43e785494f0c291","decision":"site-mobile-accordion-and-xbrowser-2026-10","materials_digest":"sha256:e3b0c44298fc1c149afbf4c8996fb92427ae41e4649b934ca495991b7852b855","obligation":"font-feature-superscript-inherits-body"}}
