{"id":"sha256:4ab7235cae904c3fb15a7aaca4a8d9dd9a6808b477e9c450273608c7c204ad62","issued_at":"2026-10-27T04:17:02Z","kind":"attestation","kind_":"test","producer":{"identity":"ci:kernel:resign","run":"run-per-obligation"},"result":"inconclusive","schema":"math-coding/attestation-3.3","subject":{"candidate_tree":"bc414ca23ec90c817234b6011bbb9cead8d3316e","decision":"forge-verify-principals-extension","materials_digest":"sha256:c425fb62bc97c50620c6aff98f421010164e3421b0699eeb3be43784b4ac7fbf","obligation":"head-override-cli"}}
