{"id":"sha256:010ea4f379d9fd2a4aff58b7b822142bc07a3317c466cde530f4e74f277c95eb","issued_at":"2026-10-25T04:58:58Z","kind":"attestation","kind_":"test","producer":{"identity":"ci:resign"},"result":"fail","schema":"math-coding/attestation-3.3","subject":{"candidate_tree":"db020e8c645f6685b5b3eac293e9b29054f92176","decision":"import-junit-rename-2026-11","materials_digest":"sha256:81fb7bb600404565ebfdc642c3e068714e7abac302e99ac4de8497a258ca1bf2","obligation":"import-junit-canonical-registered"}}
