{"id":"sha256:e7a3074618c632cd2527a3ff69aeb6c9ab2c48dcd7c793cc57b3fa97c030e011","issued_at":"2026-10-25T04:58:58Z","kind":"attestation","kind_":"test","producer":{"identity":"ci:resign"},"result":"fail","schema":"math-coding/attestation-3.3","subject":{"candidate_tree":"db020e8c645f6685b5b3eac293e9b29054f92176","decision":"waiver-infrastructure-2026-10","materials_digest":"sha256:a51128f141da9dcc93f7cb1dfdce2e0d5cb97611ecb5ae81f0c80633c46bbfc0","obligation":"self-check-uses-waivers"}}
