{"schema":"math-coding/attestation-3.0-alpha","kind":"attestation","subject":{"decision":"plan-brownfield-experiment-v2-2026-10","obligation":"this-decision-validates","candidate_tree":"HEAD","materials_digest":""},"kind_":"review","producer":{"identity":"human:maintainer"},"result":"pass","issued_at":"2026-09-29T18:00:00Z","id":"sha256:191d94891227dbafcfd460449e2ffe7f738ee8813a53e35e1b6ed545dba3ef2f"}
