{"schema":"math-coding/attestation-3.0-alpha","kind":"attestation","subject":{"decision":"mathjax-delimiter-hardening-2026-10","obligation":"mathjax-no-dollar-delimiters","candidate_tree":"HEAD","materials_digest":""},"kind_":"review","producer":{"identity":"human:maintainer"},"result":"pass","issued_at":"2026-09-29T18:00:00Z","id":"sha256:bb29bf8a514c3d268ad8030c82c0a0c38130c661956eb366fac82b9e163a4cc2"}
