{"id":"sha256:79385922b3d35a94f09f66715f808cd3e9bfe22dec691f7d4cdd8853b71e08c6","issued_at":"2026-10-25T04:58:58Z","kind":"attestation","kind_":"test","producer":{"identity":"ci:resign"},"result":"fail","schema":"math-coding/attestation-3.3","subject":{"candidate_tree":"db020e8c645f6685b5b3eac293e9b29054f92176","decision":"ux-3-attest-batch-subcommand-2026-10","materials_digest":"sha256:ca91294dba498f7b1c1ac1345f393a4682787bb893a5b84ef76d3370cb4ee6d8","obligation":"cli-attest-batch-dry-run-non-destructive"}}
