{"id":"sha256:3e0e99f1618cf8648544620785b9fd4889d39e397b02d07f2ce7a3bd165fd5e0","issued_at":"2026-10-25T04:15:12Z","kind":"attestation","kind_":"test","producer":{"identity":"ci:kernel:resign"},"result":"pass","schema":"math-coding/attestation-3.3","subject":{"candidate_tree":"2e6e09d0570a55216774e6bea7c05372b2d7accd","decision":"portable-linux-musl","materials_digest":"sha256:1ed64a432d6c173eaf60dc3e2b8b89a8dd12a42b1ee665823724f8882b3345c5","obligation":"ci-evidence-recorded"}}
