{"schema":"math-coding/attestation-3.0-alpha","kind":"attestation","subject":{"decision":"verdict-vocabulary-and-waiver-expiry-2026-10","obligation":"waiver-expiry-is-strict-at-the-boundary","candidate_tree":"HEAD","materials_digest":""},"kind_":"review","producer":{"identity":"human:maintainer"},"result":"pass","issued_at":"2026-09-29T18:00:00Z","id":"sha256:3b06cffd93f62b8cc55de4bba32821cbe6122d06d1b443ac1da9c270757c9672"}
