{"schema":"math-coding/attestation-3.0-alpha","kind":"attestation","subject":{"decision":"verify-path-forms-and-signed-attestations-2026-10","obligation":"path-form-crams-pin-the-behaviour","candidate_tree":"HEAD","materials_digest":""},"kind_":"review","producer":{"identity":"human:maintainer"},"result":"pass","issued_at":"2026-09-29T18:00:00Z","id":"sha256:db46537e94d15f1065cef44e64da109cbd76d1e2da0ad53dfc84d427a934ccb8"}
