{"id":"sha256:634f39fc4d8fa982f4650c3fab4e482e92c9547e9d3cd8ea62230d9a25bdefda","issued_at":"2026-10-26T10:56:26Z","kind":"attestation","kind_":"review","producer":{"identity":"ci:kernel:resign"},"result":"inconclusive","schema":"math-coding/attestation-3.3","subject":{"candidate_tree":"3950be2946236c62d8f6f0c87838ebee0e860bcf","decision":"mobile-menu-collapse-and-hide-on-scroll-2026-10","materials_digest":"sha256:adef39c0a1034b25fc9e85c2bc813903cfab61fb6452aa81eff8ac6aea2890db","obligation":"mobile-panel-expands-smoothly"}}
